{
  "id": "om.report-review",
  "version": "1.0.0",
  "slot": "om.report-review",
  "title": "汇报逐项质量检查",
  "level": "required",
  "scopes": [
    "仅在制作或检查汇报时适用"
  ],
  "text": "汇报交付前检查中心结论、论据覆盖、标题主线、因果关系、数字及公式、来源时点、信息密度、受众适配、明确行动和责任。检查字体、图表、配色、留白、目标设备可读性、敏感信息授权与承诺边界。确定性问题先修正，再复查受影响部分与整体一致性；核验记录单独保存，不默认塞入最终汇报。"
}
