{
  "id": "om.consistent-items",
  "version": "1.0.0",
  "slot": "om.consistent-items",
  "title": "同类条目的结构与状态表达一致",
  "level": "required",
  "scopes": [
    "选择本模板的环境；按正文条件适用"
  ],
  "text": "同一组中承担相同展示目的的同类条目，采用一致的信息结构、字段顺序、排版样式和状态表达方式。示例或具体内容不同，不应造成无必要的结构变化。\n\n状态的名称、含义和视觉表达保持一致，实际状态如实呈现；不同条目可以具有不同状态，不为了外观统一而把状态改成相同。不同类型或承担不同展示目的的内容可以采用对应结构。"
}
