{
  "id": "om.device-readable",
  "version": "1.0.0",
  "slot": "om.device-readable",
  "title": "阅读体验、容器与跨端适配",
  "level": "required",
  "scopes": [
    "选择本模板的环境；按正文条件适用"
  ],
  "text": "图表与图内文字在实际展示尺寸下必须清晰可读，禁止挤在小容器中。检查文字换行、图文环绕位置和图文对齐，优先保持读者理解的连贯性并降低阅读成本。长段文字按逻辑组合，结构化内容以结构化形式呈现。\n\n容器内正文应完整展开，避免把一段本可正常阅读的文字放入小型局部滚动区域，使读者反复拖动滚动条。排版材料同时满足移动端和 PC 端的阅读要求，分别核对实际展示效果。"
}
