{
  "id": "om.tables-compact",
  "version": "1.0.0",
  "slot": "om.table-default",
  "title": "简短表格与列表并用",
  "level": "required",
  "scopes": [
    "选择本模板的环境；按正文条件适用"
  ],
  "text": "简单对比可以采用不超过三列、每格简短的 Markdown 表格；内容较长或移动端需要横向滚动时改用分级列表。邮件和纯文本中的复杂数据提供 CSV 供表格软件读取。HTML 使用原生表格，PPT 使用可编辑原生表格或清晰截图，并在目标设备检查完整可读性。用户显式指定载体时遵循其要求。"
}
