{
  "id": "om.tables-list-first",
  "version": "1.0.0",
  "slot": "om.table-default",
  "title": "场景化表格与数据交付",
  "level": "required",
  "scopes": [
    "选择本模板的环境；按正文条件适用"
  ],
  "text": "优先移动端可读性。常规文字输出默认使用一、二、三级列表，不默认使用 Markdown 表格。邮件、纯文本和 Markdown 输出禁止直接塞入复杂表格；用户需要表格数据时优先提供 CSV 供导入 Excel，用户显式要求查看表格时按其要求展示，并保证可读性。\n\nHTML 和 PPT 可以使用符合设计规范的表格。HTML 使用原生 table 结构；PPT 自行绘制表格时使用可编辑的原生表格。常规汇报优先采用 Excel 表格截图，避免无必要地在 PPT 中重新绘制。版本交付可以先给正文，并根据交付需要把表格作为补充或妥协方案；仍须满足已约定的交付完整性、数据准确性和两端阅读要求。"
}
