{
  "id": "om.semantic-wrap",
  "version": "1.0.0",
  "slot": "om.semantic-wrap",
  "title": "语义换行与认知成本",
  "level": "required",
  "scopes": [
    "选择本模板的环境；按正文条件适用"
  ],
  "text": "横向空间足够时禁止把内容断行成短句。PPT、HTML 及其他排版内容必须按完整概念和语义边界设计换行，保持中文词语、成语、固定短语及英文单词的完整性；禁止仅为版式对齐而过早换行、拆散不可分割的语义单元，或制造孤立单字、单词。\n\n排版形式优先服务于内容理解，保持阅读连贯，降低读者的认知负担和理解成本。"
}
