{
  "id": "om.rules-tools",
  "version": "1.0.0",
  "slot": "om.rules-tools",
  "title": "规则、模板与工具 Skill 分工",
  "level": "required",
  "scopes": [
    "选择本模板的环境；按正文条件适用"
  ],
  "text": "表达、写作、工作方法、审美和交付规范保存在规则与场景模板中。Skill（技能包）保留工具入口、输入输出、接口、操作、权限和失败处理等职责，不作为审美偏好的权威来源。仅包含邮件或报告写作规范的内容归入模板；模板使用精确版本引用，选择或派生均保留来源。"
}
