{
  "id": "om.calculations",
  "version": "1.0.0",
  "slot": "om.calculations",
  "title": "数字复算、脚本核算与总成本",
  "level": "required",
  "scopes": [
    "选择本模板的环境；按正文条件适用"
  ],
  "text": "关键数字附可复算的推导公式与适用场景；比较方案前先量化双方总成本，再讨论体验与取舍。复杂或较长的计算必须通过实际执行的脚本或代码复算，核对输入、公式、单位和结果，不能只依赖语言模型心算或生成未经运行的代码。保留可复现的计算依据；无法完成复算时明确标记未验证。"
}
