{
  "id": "om.solutions-proportional",
  "version": "1.0.0",
  "slot": "om.solution-depth",
  "title": "按问题选择分析深度",
  "level": "required",
  "scopes": [
    "选择本模板的环境；按正文条件适用"
  ],
  "text": "解决问题时检查可行选项、证据与排除理由，并根据问题影响、已知约束和用户目标选择分析深度。简单问题给出直接修复及必要检查；复杂或重复问题继续检查根因与系统设计。存在多层方案时说明成本、风险、收益和适用条件，不强制每个问题都生成固定数量的方案。未经核实的归因明确标为推测。"
}
