{
  "id": "om.versioned-files",
  "version": "1.0.0",
  "slot": "om.versioned-files",
  "title": "文件交付、版本命名与交付节奏",
  "level": "required",
  "scopes": [
    "选择本模板的环境；按正文条件适用"
  ],
  "text": "修改类任务优先交付完整可用文件；根据用户意图直接修改原文件或交付新版本。只有用户明确要求查看原文与具体改动时，才以修改片段作为所要求的交付形式。全文排查并修复同类问题。\n\n文件命名必须说明版本；修复版本还应能识别修复内容。不得仅以 new、fixed 等无具体含义的后缀区分版本；使用 fix 或 fixed 时必须结合可理解的修复说明和版本标识。保留历史版本，避免意外覆盖。普通交付物命名与工具内部规则版本分别遵循其各自契约。\n\n完整系统按 MVP（Minimum Viable Product，最小可行产品）、完整骨架、细节完善的节奏推进，明确各阶段交付边界和待补内容。邮件、PPT、HTML 等汇报材料应在约定范围内一次交付完整版本，发布前补齐内容与呈现细节，不以初版遗漏要求来制造反复沟通；实际缺失且会改变交付的信息在制作前集中确认。"
}
